Product Category,Product Description,Price(Dollar),Number of  reviews,Shipment,Order Date
Audio Video ,"Cobra ACXT345 Weather-Resistant Walkie Talkies for Adults - Rechargeable, 22 Channels, Long Range 25-Mile Two-Way Radio Set (2-Pack)",7,295,Ships to Bangladesh,3/30/2019
Audio Video ,"Type C Charger Fast Charging Android USB C Phone Charger Cord 2Pack 6ft for Moto G Power 2022 2021/G Pure/G Stylus 5G 2022/G Play/G Fast/G9 Plus/G8 Power/G7 Play/Z4/Z3, Motorola One 5G UW/Edge 5G UW",19,197,Ships to Bangladesh,3/30/2019
Audio Video ,JENSEN Stereo Cassette Player with AM/FM Radio,99,455,Ships to Bangladesh,3/31/2019
Audio Video ,"Belkin 2-In-1 Iphone & Apple Watch Charging Dock - Powerhouse Charging Station + Apple Watch Charging Stand - Designed For Iphone 6/7/8/X/Xs/Xr/Xs Max, Apple Watch Series 4, 3, 2, & 1",11,887,Ships to Bangladesh,3/31/2019
Audio Video ,"Hosa CPP-202 Dual 1/4"" TS to Dual 1/4"" TS Stereo Interconnect Cable, 2 Meters",52,"2,450",Ships to Bangladesh,3/31/2019
Audio Video ,"mophie Universal Wireless Charging Stand - 15 Watt Fast Charging for Qi-Cerified Phones Like Samsung Galaxy, Google Pixel, Apple iPhone 11 (Pro, Pro Max), iPhone XR/XS/SE, iPhone 8 - Black",12,194,Ships to Bangladesh,3/31/2019
Audio Video ,"Blue Sea Systems BelowDeck Panels, Dual USB Chargers, 12V Sockets and Mini OLED Monitors",129,"1,916",Ships to Bangladesh,3/31/2019
Audio Video ,"BOSCH GPB18V-2CN 18V Compact Jobsite Radio with Bluetooth® 5.0 , Black",39,104,Ships to Bangladesh,3/31/2019
Audio Video ,OnePlus SUPERVOOC 80W Car Charger,253,60,Ships to Bangladesh,3/31/2019
Audio Video ,ICOM 2300H 05 144MHz Amateur Radio,8,167,Ships to Bangladesh,3/31/2019
Audio Video ,"Fast Car Charger, 2Pack 3.4A Fast Charging Car Adapter Dual Port Cigarette Lighter USB Charger for iPhone 14 13 12 11 Pro Max SE XR XS X 8 7 6 6S Plus,Samsung Galaxy S22 S21 S20 S10 S9 S8 A13 A12 A51",28,"1,806",Ships to Bangladesh,3/31/2019
Audio Video ,Hefty Bike Phone Mount by Delta Cycle - Premium Universal Bicycle Smartphone Holder Adjusts to Any Handlebar & Fits Any Phone or iPhones - Easily Accessible On The Go - Hands-Free Access,119,434,Ships to Bangladesh,4/1/2019
Audio Video ,"House of Marley Get Together Mini: Portable Speaker with Wireless Bluetooth Connectivity, 10 Hours of Indoor/Outdoor Playtime, and Sustainable Materials, Signature Black",74,312,Ships to Bangladesh,4/1/2019
Audio Video ,"BAOFENG UV-5RTP 8/4/1W Two-Way Radio, High Power Dual Band Long Range for Adults, Tri-Power Handheld Ham Radio with Speaker Mic, Programming Cable (2 Pack)",225,672,Ships to Bangladesh,4/1/2019
Audio Video ,Sangean ATS-909X2 The Ultimate FM/SW/MW/LW/Air Multi-Band Radio,39,331,Ships to Bangladesh,4/1/2019
Audio Video ,"mophie Dual Universal Wireless Charging Pad - 10 Watt, Works with Qi-Certified Devices, Fast Charge for Samsung Galaxy, Google Pixel, Apple iPhone, Apple AirPods, and Extra USB-A Port for Apple Watch",56,"1,106",Ships to Bangladesh,4/2/2019
Audio Video ,"Cobra ACT120B Chat Tag Curve Wearable Walkie Talkies for Adults - Push to Talk, Rechargeable, Up to 12-Mile Two Way Radio Set (2 Pack)",99,616,Ships to Bangladesh,4/2/2019
Audio Video ,"Uniden PRO501TK Pro-Series 40-Channel Portable Handheld CB Radio, Two-Way Emergency Radio, includes High-Gain Magnet Mount Antenna, Auto Noise Limiter, NOAA Weather, and Full Channel Scan",216,531,Ships to Bangladesh,4/2/2019
Audio Video ,JBL JBL-PRV275 AM/FM/WB/USB Round Digital Bluetooth Receiver,262,136,& Up,4/2/2019
Audio Video ,"GPX, Inc. Portable Top-Loading CD Boombox with AM/FM Radio and 3.5mm Line In for MP3 Device - Red/Black",39,"5,867",Ships to Bangladesh,4/2/2019
Audio Video ,"Bang & Olufsen Beoplay A9 4th Gen Wireless Multiroom Speaker, White with Oak Legs","2,537",51,Ships to Bangladesh,4/2/2019
Audio Video ,"IPEVO V4K PRO Ultra HD USB Document Camera with AI-Enhanced Mic, for Classroom visualization, Online Teaching, Work from Home, Streaming, with Noise Cancellation for Clear Voice",144,147,Ships to Bangladesh,4/3/2019
Audio Video ,"Belkin SOUNDFORM Elite Hi-Fi Smart Speaker + Wireless Charger (Alexa Voice-Controlled Bluetooth Speaker) Sound Technology By Devialet, Fast Wireless Charging for iPhone, Samsung Galaxy & More - Black",129,615,Ships to Bangladesh,4/3/2019
Audio Video ,"Portable CD Player - Homlab Bluetooth Desktop CD Player with Speakers, Dust Cover, FM Radio, Anti-skip Protection, Music Player Home Audio Boombox with LCD Display, Remote, Aux Input",39,49,Ships to Bangladesh,4/3/2019
Audio Video ,SCOSCHE BTFM5 Bluetooth Hands-Free Car Kit with Digital FM Transmitter and Dual 12W USB Charging Ports For Vehicles,24,183,Ships to Bangladesh,4/4/2019
Audio Video ,"Scosche MPQ5DV-XTSP MagicMount Pro Charge5 15W Wireless Charging Dashboard / Vent Magnetic Phone Mount for Car. Updated for MagSafe iPhone 12/13/14 Pro/Pro Max, Plus, Mini along with Galaxy and more",59,85,Ships to Bangladesh,4/4/2019
Audio Video ,JENSEN CD-485-GR CD-485 1-Watt Portable Stereo CD Player with AM/FM Radio (Green),40,402,Ships to Bangladesh,4/4/2019
Audio Video ,TRAM 3-B-HC Fiberglass CB Antenna H.D. FIBERGLASS,15,"1,072",Ships to Bangladesh,4/4/2019
Audio Video ,"SAMSUNG SmartThings Station with Power Adapter, 15W Super Fast Wireless Charger, Smart Home Hub, 2023, EP-P9500TBEGUS, Black",79,5,Ships to Bangladesh,4/4/2019
Audio Video ,Sangean DT-200X FM-Stereo/AM Digital Tuning Pocket Radio Black,41,"1,644",Ships to Bangladesh,4/4/2019
Audio Video ,Bitty Boomers Star Wars: Chrome Mandalorian - Mini Bluetooth Speaker,7,679,Ships to Bangladesh,4/4/2019
Audio Video ,"Standard Horizon MH-73A4B Speaker/Microphone Black, Small",55,149,Ships to Bangladesh,4/4/2019
Audio Video ,"Poly - Sync 40+ Bluetooth Smart Speakerphone (Plantronics) - Flexible Work Spaces - Connect to PC/Mac via Included BT600 Dongle & Smartphones via Bluetooth - Works with Teams (Certified), Zoom & more",259,49,Ships to Bangladesh,4/5/2019
Audio Video ,"BulbHead Phone Crane Mount for Car, As Seen On TV, Ultra-Long Arm Raises Over a Foot Higher, Drive Safer, 360° Rotation, Vertical & Horizontal Adjustment, Twistable Base Fits Any Cupholder",22,265,Ships to Bangladesh,4/5/2019
Audio Video ,Sangean PR-D18BK AM/FM/Portable Digital Radio with Protective Bumper (Gray/Black) Black/ Grey,47,"2,750",Ships to Bangladesh,4/5/2019
Audio Video ,"USB Charger 10-Port 120W, Multi-Port USB Charging Hub 24A Desktop Power Station for iPhone X/8/7/6S/6 Plus/5S, Ipad Pro/Air2/ Mini, Galaxy S9/S8/S6 Edge",35,344,Ships to Bangladesh,4/5/2019
Audio Video ,"Poly - Sync 40 Smart Speakerphone (Plantronics) - Flexible Work Spaces - Connect to PC/Mac via Combined USB-A/USB-C Cable and Smartphones via Bluetooth - Works with Teams, Zoom & more",216,116,Ships to Bangladesh,4/5/2019
Audio Video ,Pack Of 10 Type C Fast Charge Cable USB Cord Charging Rapid Quick Charger For Samsung Galaxy S21 S20 5G S10 S9 S8 Note 20 10 9 8 Galaxy A20 A21 A32 A50 A51 A70 A71 LG V60 V50 V40 V30 ThinQ Stylo 4 5 6,8,472,Ships to Bangladesh,4/5/2019
Audio Video ,"RoadPro (RP-711) 24"" Magnet Mount Stainless Steel CB Antenna Kit",24,"1,377",Ships to Bangladesh,4/5/2019
Audio Video ,"Monoprice 8-Channel 1/4-Inch TRS Male to 1/4-Inch TRS Male Snake Cable - 3 Feet, 26AWG, 8 Balanced Mono and Unbalanced Stereo Lines",15,825,Ships to Bangladesh,4/5/2019
Audio Video ,Sangean WR-22WL AM/FM-RDS/Bluetooth/USB Table-Top Digital Tuning Receiver (Dark Walnut),149,"1,419",Ships to Bangladesh,4/5/2019
Audio Video ,Tascam CD-A580 Rackmount Cassette/CD/USB MP3 Player Recorder Combo,699,149,Ships to Bangladesh,4/5/2019
Audio Video ,Battery Eliminator Car Charger for BAOFENG UV-5R UV-5R+ UV-5RA UV-5RA+ UV-5RB UV-5RC UV-5RD UV-5RE UV-5RE Plus,8,"1,364",Ships to Bangladesh,4/5/2019
Audio Video ,"RoadKing RK56CHSS Chrome Noise Canceling CB Microphone with Chrome Flex Cord,XLR",47,397,Ships to Bangladesh,4/5/2019
Audio Video ,"Tascam Master 424 High Bias Type II Cobalt Studio Cassette, Multi (MASTR CAS)",12,43,Ships to Bangladesh,4/5/2019
Audio Video ,"iOttie Velox Magnetic Flush Mount Car Phone Holder. Compatible with MagSafe iPhones Including iPhone 12/iPhone 13/iPhone 14, iPhone 12/13/14 Pro & Pro Max, iPhone 12/13 Mini, iPhone 14 Plus",19,171,Ships to Bangladesh,4/6/2019
Audio Video ,"TALK WORKS Aux Cable 3.5mm Audio Cord for Car - 6ft Long Heavy-Duty Male to Male Jack Extension & Adapter Aux Cord for iPhone, Android, Samsung Galaxy, Headphones, Slate - 2 Pack",7,"3,457",Ships to Bangladesh,4/6/2019
Audio Video ,"mophie Snap+ 2-in-1Charge Stand & Pad - 15w Wireless Charger Compatible with iPhones & AirPods, Includes Snap+ Adapter for Other Qi Enabled Phones, Steel Base, Adjustable Angles",9,47,Ships to Bangladesh,4/6/2019
Audio Video ,"Belkin 24 Watt Dual USB Car Charger - 2 12W USB A Ports with Lightning Cable - Fast Charging Apple iPhone 14, 14 Pro, 14 Pro Max, iPhone 13, 13 Pro Max, Samsung Galaxy, AirPods & More - USB-C Charger",55,555,Ships to Bangladesh,4/6/2019
Audio Video ,"OtterBox Fast Charge USB-C Wall Charger, 20 Watt - WHITE for Iphone",20,253,Ships to Bangladesh,4/6/2019
Audio Video ,Harman Kardon Onyx Studio 4 Wireless Bluetooth Speaker - Black (Renewed),12,26,Ships to Bangladesh,4/6/2019
Audio Video ,"Astatic 302636LCF 636L Noise-Canceling 4-Pin CB Microphone, XLR",159,168,Ships to Bangladesh,4/6/2019
Audio Video ,"iClever BoostCube 2nd Generation 24W Dual USB Wall Charger with SmartID Technology, Foldable Plug, Travel Power Adapter for iPhone Xs/XS Max/XR/X/8 Plus/8/7 Plus/7/6S/6 Plus, iPad Pro Air/Mini and Other Tablet",38,"18,927",Ships to Bangladesh,4/6/2019
Audio Video ,OnePlus Warp Charge | 50W Wireless Charger,15,623,Ships to Bangladesh,4/6/2019
Audio Video ,OtterBox Wireless Charging Pad for MagSafe - BLACK,69,91,Ships to Bangladesh,4/6/2019
Audio Video ,"Poly - Sync 20+ Bluetooth Speakerphone (Plantronics) - Personal Portable Speakerphone - USB-C Bluetooth Adapter - Connect to Your PC/Mac/Cell Phone - Works with Teams (Certified), Zoom & More",24,187,Ships to Bangladesh,4/6/2019
Audio Video ,"Arkon Swivel Belt Clip Holder for Smartphones Cameras Radios Walkie Talkies Remotes, Black - CM221 6.20in. x 4.25in. x 0.50in.",153,"1,486",Ships to Bangladesh,4/6/2019
Audio Video ,"Belkin 3-In-1 Wireless Charging Station - Fast Wireless Charging For Apple Iphone 14, Iphone 13 & Iphone 12 Series & Apple Watch (All Series) - With Additional USB A Port For Multiple Devices (White)",8,"1,902",Ships to Bangladesh,4/6/2019
Audio Video ,"RapidX MyDesktop Pro 60W 3 USB Ports and 2 Power Outlets Power Station with Wireless Charging Stand for iPhone, Android, Tablets and Laptops, Blue",139,12,Ships to Bangladesh,4/7/2019
Audio Video ,"iOttie Easy One Touch Mini Dash & Windshield Car Mount Phone Holder || iPhone Xs Max R 8 Plus 7 Samsung Galaxy S10 E S9 S8 Plus Edge, Note 9 & Other Smartphones",59,"1,176",Ships to Bangladesh,4/7/2019
Audio Video ,"Samsung 15W Wall Charger Type C Only (Cable not Included), White",16,59,Ships to Bangladesh,4/7/2019
Audio Video ,"OM Digital Solutions Voice Recorder DM-720 with 4GB, Micro SD Slot, USB Charging, Direction PC Connection, Transcription Mode, Silver",10,215,Ships to Bangladesh,4/7/2019
Audio Video ,"Aiwa Portable Boombox, Crystal Clear Sound with 3W x 2 Speakers and Bass Function, Featuring a 7"" LCD Display, Bluetooth Connectivity, FM Radio, CD/DVD Player, Streaming on Roku and Amazon Firestick",129,77,Ships to Bangladesh,4/7/2019
Audio Video ,"Belkin Boost?Charge™ 30W Fast Car Charger, Compact Design w/USB-C Power Delivery Port, Universal Compatibility for iPhone 14, Galaxy S23, Note Series, and More - Black",149,24,Ships to Bangladesh,4/8/2019
Audio Video ,Reiko Car Steering Wheel Phone Mount - Retail Packaging - Gray - HLD07-GY,19,"1,922",Ships to Bangladesh,4/8/2019
Audio Video ,"Altec Lansing LifeJacket XL Jolt with Lights, Built In Qi Wireless Charger, Waterproof, Snowproof, Shockproof and it Floats in Water, Up to 20 Hour Battery Life, Black",3,594,Ships to Bangladesh,4/8/2019
Audio Video ,Lifeproof LIFEACTÍV Armband with QuickMount - Retail Packaging - Black,83,"3,131",& Up,4/8/2019
Audio Video ,"Marshall Stanmore II Bluetooth Speaker, Brown",379,202,Ships to Bangladesh,4/8/2019
Audio Video ,"Monoprice 1/4-Inch TRS Male to 1/4-Inch TRS Male Guitar Pedal Patch Cable - 8 Inch - Black, Right Angle Connectors - Premier Series",7,749,Ships to Bangladesh,4/8/2019
Audio Video ,"Motorola Solutions Talkabout Radio, Orange",63,"1,022",Ships to Bangladesh,4/8/2019
Audio Video ,"Samsung 15W Wall Charger Type C Only (Cable not Included), Black",14,217,Ships to Bangladesh,4/11/2019
Audio Video ,"Belkin 45W Dual USB-C Wall Charger, Fast Charging Power Delivery 3.0 with GaN Technology for iPhone 14, 13, Pro, Pro Max, Mini, iPad Pro 12.9, MacBook, Galaxy S23, S23+, Ultra, Tablet, More - White",32,39,Ships to Bangladesh,4/11/2019
Audio Video ,"Altec Lansing Mix 2.0 - Waterproof Bluetooth Speaker with Strong Bass, Portable Speaker for Travel & Outdoor Use, 100 Foot Range & 20 Hour Playtime, Black",146,649,Ships to Bangladesh,4/11/2019
Audio Video ,"OtterBox Premium Wireless Fast Charing Pad, 15W - Black",39,10,Ships to Bangladesh,4/11/2019
Audio Video ,"iOttie iON Wireless Duo CERTIFIED BY GOOGLE 10W Stand + 5W Pad Qi-Certified Charger | MADE FOR GOOGLE | Compatible with Google, Google Pixel, Pixel Buds | Includes Power Cable & Adapter | Dark Grey",49,"1,772",Ships to Bangladesh,4/11/2019
Audio Video ,"TASCAM 4-Channel Portable Linear PCM Audio Recorder for DSLR and Video Cameras, Black (DR-70D)",299,352,Ships to Bangladesh,4/11/2019
Audio Video ,"iOttie Aivo Boost Dual Port USB-A/USB-C Car Charger with Alexa Built-in, High-Speed USB-C PD 3.0/QC 4.0+, and USB-A QC 3.0 car Adapter for Apple, Android, and Google Phones and Tablets",49,244,Ships to Bangladesh,4/11/2019
Audio Video ,"Midland T71VP3 36 Channel FRS Two-Way Radio - Up to 38 Mile Range Walkie Talkie - Black/Silver (Pack of 4), 6.2"" x 1.3"" x 2.3"", Model Number: T71X4VP3",159,195,Ships to Bangladesh,4/11/2019
Audio Video ,ONEPLUS Fast Charge Type-C Cable (100cm),19,20,Ships to Bangladesh,4/11/2019
Audio Video ,"Bang & Olufsen Beosound Emerge Bookshelf Wi-Fi Speaker, Gold Tone/Light Oak",799,25,Ships to Bangladesh,4/12/2019
Audio Video ,"Scosche CPDCC40 PowerVolt 40-Watt Certified USB Type-C Fast Car Charger Power Delivery 3.0 for Standard USB-C Devices, Dual USB-C Charger",24,213,Ships to Bangladesh,4/12/2019
Audio Video ,Standard Horizon HX400IS Intrinsically Safe Handheld VHF Radio,259,19,Ships to Bangladesh,4/12/2019
Audio Video ,"Altec Lansing LifeJacket Jolt - Waterproof Bluetooth Speaker, Durable & Portable Speaker with Qi Wireless Charging and Voice Assistant, Black w/Lights",93,191,Ships to Bangladesh,4/12/2019
Audio Video ,Retevis 2 Pin Shoulder Mic Speaker 2 Way Radio Microphone for Baofeng BF-888S UV-5R Kenwood Retevis H-777 RT21 RT22 RT-5R Walkie Talkie (5 Pack),36,292,Ships to Bangladesh,4/12/2019
Audio Video ,"Hosa CMP-303 3.5 mm TS to 1/4"" TS Mono Interconnect Cable, 3 feet, Speaker",5,"2,052",Ships to Bangladesh,4/12/2019
Audio Video ,Midland GXT1000VP4 50 Channel GMRS Two-Way Radio - Up to 36 Mile Range Walkie Talkie - Black/Silver (Pack of 8),349,42,Ships to Bangladesh,4/13/2019
Audio Video ,Bitty Boomers Netflix: Stranger Things - Damaged Demogorgon - Mini Bluetooth Speaker,10,101,Ships to Bangladesh,4/13/2019
Audio Video ,Skullcandy Barricade Mini Wireless Portable Speaker - Black,39,"1,051",Ships to Bangladesh,4/13/2019
Audio Video ,NTW USB Data Blocker/USB Charger/Secure Charging USB Adapter USB Condom for Blocking Data Sync/Protect Against Juice Jacking/Charge Only Adapter -NUSBX-KDL-A3C2 (5PK),9,13,Ships to Bangladesh,4/13/2019
Audio Video ,"PopSockets Phone Wallet, Phone Card Holder, Wireless Charging Compatible, Wallet for MagSafe - White",25,3,Ships to Bangladesh,4/13/2019
Audio Video ,"Belkin 108W GaN USB Charging Station for Multiple Devices, 2 Type C and 2 Type A Ports Fast Desktop Charger Dock Hub for iPhone, Apple Watch, iPad Pro, Air, Mini, MacBook Pro 16 inch 14 inch and Air",34,25,& Up,4/15/2019
Audio Video ,"Naxa NDL-287 Bluetooth DVD Boom Box & TV, Black, 7""",184,335,Ships to Bangladesh,4/15/2019
Audio Video ,"Wireless Charging Station for Apple Multiple Devices, Wired Charger for Tablet Stand iPad Holder, Wireless Charger for iPhone 14 Pro Max/13/12, AirP od Pro 3/2, Watch Charger for iWatch Series 8/7/6",57,79,Ships to Bangladesh,4/16/2019
Audio Video ,"PopSockets Phone Wallet with Expanding Grip, Phone Card Holder, Wireless Charging Compatible, Wallet for MagSafe - slime Green",39,15,Ships to Bangladesh,4/18/2019
Audio Video ,"GPX PCB319B Portable Cd Player with Bluetooth, Includes Stereo Earbuds, Black",36,"1,465",Ships to Bangladesh,4/18/2019
Audio Video ,Marshall Emberton Bluetooth Portable Speaker - Forest Green,149,159,Ships to Bangladesh,4/18/2019
Audio Video ,Gemini Sound CDMP-1500 19 Inch Professional/Home Anti Shock Audio Rackmount Single Disc Drive Mountable CD MP3 USB Media Music Player System Input with Remote,230,74,Ships to Bangladesh,4/18/2019
Audio Video ,"Poly - Sync 20+ Bluetooth Speakerphone - Personal Portable Speakerphone - Noise & Echo Reduction - USB-A Bluetooth Adapter - Compatible to connect to your PC/Mac/Cell Phone - Works with Teams, Zoom",129,199,Ships to Bangladesh,4/18/2019
Audio Video ,"Belkin 20 Watt USB C Car Charger with Fast Charging for Apple iPhone 14, 14 Pro, 14 Pro Max, iPhone 13, 13 Pro, 13 Pro Max, Samsung Galaxy S22 Ultra & More (USB-C to Lightning Cable Included) - Black",31,334,Ships to Bangladesh,4/18/2019
Audio Video ,"Altec Lansing Baby Boom XL - Waterproof Bluetooth Speaker, Wireless & Portable for Travel & Outdoor Use, Deep Bass & Loud Sound, 1 Pack, Black",29,"1,657",Ships to Bangladesh,4/18/2019
Audio Video ,RoadPro RP-83W Standard Series White 3' Mirror Mount Fiberglass CB Antenna Kit,17,43,Ships to Bangladesh,4/18/2019
Audio Video ,"Pyle Wireless Portable Bluetooth Boombox Speaker - 200 Watt Rechargeable Boom Box Speaker Portable Music Barrel Loud Stereo System With AUX Input, MP3/USB/SD Port, Fm Radio, 4"" Tweeter - PBMSPG1BK",39,881,Ships to Bangladesh,4/19/2019
Audio Video ,"Car Cassette Adapter, Standard Packaging",9,"3,317",Ships to Bangladesh,4/19/2019
Audio Video ,DVT2810 Voicetracer Digital (Win Version),105,936,Ships to Bangladesh,4/19/2019
Audio Video ,"Hisense Ultimate Wireless Outdoor/Indoor Party Speaker with subwoofer 2.0CH 300W IPX4 Waterproof Bluetooth5.0 (Party Rocker One, 2023 Model), Black",249,2,Ships to Bangladesh,4/20/2019
Audio Video ,"Motorola T100TP Talkabout Radio, 3 Pack",49,"6,289",Ships to Bangladesh,4/20/2019
Audio Video ,"Trexonic Portable Rechargeable 14 Inch 720p LED TV with HDMI, SD/MMC, USB, VGA, AV in/Out and Built-in Digital Tuner",113,693,Ships to Bangladesh,4/20/2019
Audio Video ,"Belt Clip Cell Phone Holder – 3M Adhesive Belt Clip Phone Holster GPS, Walkie-Talkie Compatible with iPhone 14 Pro Max Plus 13 12 11 Galaxy Z Fold, Z Flip S22 S21 Google Pixel LG Moto",7,779,Ships to Bangladesh,4/20/2019
Audio Video ,Belkin Universal Phone Mount For Car - Car Mount for Devices Up To 6” - Windshield or Dashboard Phone Holder - Cell Phone Holder Car - iPhone Car Mount - Dash Mount iPhone Car Holder For 6” Smartphone,29,"3,457",Ships to Bangladesh,4/21/2019
Audio Video ,Cellet Multipurpose Non Slip Phone Mini Suction Cup Mat Pack Of 5 Compatible With iPhone 14 Pro Max Plus 13 12 11 Xr Xs X 10 SE Galax Z Flip Z Fold S22 Note Google Pixel Moto,10,193,Ships to Bangladesh,4/21/2019
Audio Video ,Pyle Upgraded Waterproof MP3 Player - V2 Flextreme Sports Wearable Headset Music Player 8GB Underwater Swimming Jogging Gym Earphones Rechargeable Flexible Headphones USB Connection9 -PSWP14BK,44,926,Ships to Bangladesh,4/22/2019
Audio Video ,"Samsung Electronics Wireless Charger Trio, Qi Compatible - Charge up to 3 Devices at Once - for Galaxy Phones, Buds, Watches, and Apple iPhone Devices, White (US Version)",47,461,Ships to Bangladesh,4/22/2019
Audio Video ,RG58A/U COAX CABLE 3 foot Jumper for CB / Ham Radio - Workman CX-3-PL-PL -Made in the USA,5,"2,180",Ships to Bangladesh,4/23/2019
Audio Video ,"Margaritaville Tiki Torch - Waterproof Bluetooth Speaker, Portable Party Speaker with Flickering LED Lights, Perfect for Travel, Parties, Yards, and Pools (2 Pack)",89,54,Ships to Bangladesh,4/23/2019
Audio Video ,Motorola Solutions T470 Two-Way Radio Black W/Yellow Rechargeable Two Pack,99,91,Ships to Bangladesh,4/23/2019
Audio Video ,"mophie Snap+ Wireless Vent Mount Universal Charger, 15W Charging, Magnetic Positioning for Accurate Placement, One-Hand Operation, Compatible with Magsafe for iPhone 12 Models & Qi- Enabled Devices",42,144,Ships to Bangladesh,4/23/2019
Audio Video ,"Altec Lansing LifeJacket H2O 4 - Waterproof Bluetooth Speaker, Durable & Portable Speaker with Voice Assistant, 10 Hour Battery Life & 100 Foot Range, Black",48,"1,392",Ships to Bangladesh,4/23/2019
Audio Video ,"Hamilton Buhl Classroom Cassette Player, 2 Station, 1 Watt (D132) (HA802)",34,718,Ships to Bangladesh,4/23/2019
Audio Video ,"Emerson Alarm Clock Radio and QI Wireless Phone Charger with Bluetooth, Compatible with iPhone XS Max/XR/XS/X/8/Plus, 10W Galaxy S10/Plus/S10E/S9, All Qi Compatible Phones, ER100202",50,"5,209",Ships to Bangladesh,4/25/2019
Audio Video ,"Sangean MMR-88 AM/FM/Weather+Alert Emergency Radio. Solar/Hand Crank/USB/Flashlight, Siren, Smartphone Charger yellow",124,"1,519",Ships to Bangladesh,4/25/2019
Audio Video ,Wouxun KG-905G Professional GMRS Two Way Radio,18,33,Ships to Bangladesh,4/25/2019
Audio Video ,Bitty Boomers Star Wars: The Mandalorian - Grogu in Pram - Mini Bluetooth Speaker,6,75,Ships to Bangladesh,4/25/2019
Audio Video ,"Hosa CMS-105 3.5 mm TRS to 1/4"" TRS Stereo Interconnect Cable, 5 Feet",14,706,Ships to Bangladesh,4/25/2019
Audio Video ,"OM System WS-883 Digital Voice Recorder, Linear PCM/MP3 Recording Formats, USB Direct, 8gb Playback Speed and Volume Adjust, File Index, Erase Selected Files",89,12,Ships to Bangladesh,4/25/2019
Audio Video ,Midland GXT1000VP4 50 Channel GMRS Two-Way Radio - Up to 36 Mile Range Walkie Talkie - Black/Silver (Pack of 4),174,349,Ships to Bangladesh,4/26/2019
Audio Video ,"Eton - Elite Traveler AM/FM/LW/Shortwave Radio with RDS & Custom Leather Carry Cover, 500 Station Memory, Sleep Timer, Local/World Time Setting, Snooze Function, Orange LCD Display, Earphone Jack",79,619,Ships to Bangladesh,4/26/2019
Audio Video ,"mophie - 15W Wireless Charging Stand Compatible with snap and MagSafe for Smartphones, iPhone, Google Pixel, Samsung Galaxy, Qi-Enabled Devices",51,74,Ships to Bangladesh,4/26/2019
Audio Video ,iLive iKBC384S Bluetooth Under the Cabinet Radio with CD Player,69,"3,348",Ships to Bangladesh,4/26/2019
Audio Video ,"Sangean HDR-14 HD Radio/FM Stereo/AM Portable Radio, standart , Black",42,684,Ships to Bangladesh,4/28/2019
Audio Video ,"Tram 1241 5"" NMO Magnet Mount , Black",17,58,Ships to Bangladesh,4/28/2019
Audio Video ,Bitty Boomers Marvel: Into The Spider-Verse - Miles Morales - Mini Bluetooth Speaker,8,137,Ships to Bangladesh,4/28/2019
Audio Video ,"Hosa STP-201 1/4"" TRS to Dual 1/4"" TS Insert Cable, 1 Meter",26,754,Ships to Bangladesh,4/28/2019
Audio Video ,"SIIG 90W Smart 10-Port USB Charging Station with Non-Slip Padded Deck and LED Ambient Light for Smartphones, Tablets, and Many Other Compatible USB Powered Devices (Black)",62,860,Ships to Bangladesh,4/28/2019
Audio Video ,"GPX BCA209B Portable Am/FM Boombox with CD and Cassette Player, Black",46,"5,138",& Up,4/28/2019
Audio Video ,"StarTech.com 6 ft Slim 3.5mm Stereo Audio Cable - M/M - 3.5mm Male to Male Audio Cable for Your Smartphone, Tablet or MP3 Player (MU6MMS) Black",4,"15,220",& Up,4/28/2019
Audio Video ,"Pyle Bluetooth Speaker & Microphone System - Portable Stereo Karaoke Speaker with Wired Mic, Built-in LED Party Lights, MP3/USB, FM Radio (6.5’’ Subwoofers, 500 Watt MAX) (PPHP266B.5)",18,26,& Up,4/28/2019
Audio Video ,"SYLVOX 27 Inch TV 12/24 Volt TV Full HD RV TV,1080P,Built-in DVD Player and FM Radio, for Home, RV Camper and Mobile Use",99,20,& Up,4/28/2019
Audio Video ,Scosche MPDCFA MagicMount Pro Magnetic Mount Holder For Mobile Devices Carbon Fibe,24,"2,183",Ships to Bangladesh,4/29/2019
Audio Video ,"Nelson-Rigg Route 1 Magnetic Phone holder, Black (NR-50)",34,185,Ships to Bangladesh,4/29/2019
Audio Video ,"Ceptics Schuko, Germany, France, Spain Travel Adapter Plug with Dual USB - Usa Input Type E/F - Ultra Compact Perfect for Cell Phones, Laptop, Camera Chargers, iWatch, iPad, iPhone and More (CTU-9)",13,"8,167",Ships to Bangladesh,4/29/2019
Audio Video ,"Cobra HG A1000 18.5 inch Magnetic Mount CB Antenna – Heavy Duty Magnet, For use in Cars, SUVS Recreational Vehicles 100 Watt Power Handling Capability, Black",34,435,Ships to Bangladesh,4/29/2019
Audio Video ,"Browning WSPBR1015 Enclosed Nmo 3/4 Hole Mount,Black",23,838,Ships to Bangladesh,4/29/2019
Audio Video ,"INIU 3 in 1 Wireless Charging Station, 15W Fast Phone Wireless Charger Stand Dock for Apple Watch Charger Stand Series 8 7 6 5 4 3 SE Ultra, iPhone 14 13 12 11 Pro Max Mini, Airpods Pro (with Adapter)",39,435,Ships to Bangladesh,4/29/2019
Audio Video ,"Belkin BoostCharge USB C 30W GaN Wall Charger w/ Power Delivery - iPhone Charger Fast Charging - USB C Charger for MacBook Pro, iPhone 14, iPhone 13, iPhone 12, iPad Pro - Includes Lightning Cable",30,60,Ships to Bangladesh,4/30/2019
Audio Video ,Sangean PR-D19BK FM Stereo/AM Digital Tuning Portable Radio with Protective Bumper (Gray/Black),56,813,Ships to Bangladesh,4/30/2019
Audio Video ,"TALK WORKS USB C to USB C Cable 10 ft Android Phone Charger Heavy Duty PD Type C Fast Charging Power Delivery Cord for Samsung Galaxy S21, 20, 10, 9, 8, for Apple MacBook, iPad Pro, Switch - White",9,235,Ships to Bangladesh,4/30/2019
Audio Video ,"Hosa CMS-110 3.5 mm TRS to 1/4"" TRS Stereo Interconnect Cable, 10 Feet",5,"1,342",Ships to Bangladesh,5/2/2019
