Product Category,Product Description,Price(Dollar),Number of  reviews,Shipment,Order Date
Audio Video ,"Upgraded, Anker Soundcore Bluetooth Speaker with IPX5 Waterproof, Stereo Sound, 24H Playtime, Portable Wireless Speaker for iPhone, Samsung and More",27,"82,773",Ships to Bangladesh,1/3/2019
Audio Video ,"Twelve South AirFly Pro Bluetooth Wireless Audio Transmitter/ Receiver for up to 2 AirPods /Wireless Headphones; Use with any 3.5 mm Audio Jack on Airplanes, Gym Equipment, TVs, iPad/Tablets and Auto",54,"5,121",Ships to Bangladesh,1/4/2019
Audio Video ,"iOttie Easy One Touch 5 Dashboard & Windshield Universal Car Mount Phone Holder Desk Stand with Suction Cup Base and Telescopic Arm for iPhone, Samsung, Google, Huawei, Nokia, other Smartphones Black",24,"126,957",Ships to Bangladesh,1/4/2019
Audio Video ,"INIU Wireless Charger, 15W Fast Wireless Charging Station with Sleep-Friendly Adaptive Light Compatible with iPhone 14 13 12 Pro XR XS 8 Plus Samsung Galaxy S23 S22 S21 S20 Note 20 10 Google LG etc",15,"18,837",Ships to Bangladesh,1/4/2019
Audio Video ,JBL Flip 4 Waterproof Portable Bluetooth Speaker - Blue,78,"13,141",Ships to Bangladesh,1/5/2019
Audio Video ,"USB C Charger 20W, Anker 511 Charger ( Nano ), PIQ 3.0 Durable Compact Fast Charger with 6ft USB C to Lightning Cable (MFi Certified) for 14/14 Plus/14 Pro/14 Pro Max/13/ iPad Pro and More",30,"11,748",Ships to Bangladesh,1/6/2019
Audio Video ,"Panasonic Portable AM / FM Radio, Battery Operated Analog Radio, AC Powered, Silver (RF-2400D) 22.8 x 7.8 x 10.8",28,"26,724",Ships to Bangladesh,1/6/2019
Audio Video ,"Belkin MagSafe 3-in-1 Wireless Charging Stand - 2ND GEN w/ 33% Faster Wireless Charging for Apple Watch - iPhone 14, 13 & 12 series & AirPods - MagSafe Charging Station For Multiple Devices - Black",127,"5,762",Ships to Bangladesh,1/6/2019
Audio Video ,"Scosche MAGDMB MagicMount Magnetic Car Phone Holder Mount - 360 Degree Adjustable Head, Universal with All Devices - Dashboard Mount",12,"33,877",Ships to Bangladesh,1/6/2019
Audio Video ,SAMSUNG 25W USB-C Super Fast Charging Wall Charger - Black (US Version with Warranty),19,"8,765",Ships to Bangladesh,1/6/2019
Audio Video ,"Anker 315 Wireless Charger (Pad), 10W Max Fast Charging, Compatible with iPhone 14/13 Series, Samsung S22, AirPods, Samsung Buds, Google Buds, and More (Wall Charger Not Included)",14,"1,661",Ships to Bangladesh,1/6/2019
Audio Video ,"Soundcore Anker Motion Boom Outdoor Speaker with Titanium Drivers, BassUp Technology, IPX7 Waterproof, 24H Playtime, App, Built-in Handle, Portable Bluetooth Speaker for Outdoors, Camping",99,"7,304",Ships to Bangladesh,1/6/2019
Audio Video ,"Belkin MagSafe Vent Mount Pro - MagSafe Phone Mount For Car - Car Accessories - Car Phone Holder Mount - Magnetic Phone Holder for iPhone 14, iPhone 13, iPhone 12 Pro Max, Pro, and Mini Models",39,"7,409",Ships to Bangladesh,1/6/2019
Audio Video ,"Deluxe Products CD Player Portable with 60 Second Anti Skip, Stereo Earbuds, Includes Aux in Cable and AC USB Power Cable for use at Home or in Car",22,"4,027",Ships to Bangladesh,1/6/2019
Audio Video ,"Amazon Basics 12W (5V, 2.4A) Car Charger with Lightning Cable (Coiled) for iPhone and Apple Devices, 1.5 ft - Black",10,"10,101",Ships to Bangladesh,1/7/2019
Audio Video ,"SAMSUNG 25W Wall Charger USB C Adapter, Super Fast Charging Block for Galaxy Phones and Devices, Cable Not Included, 2021, US Version, Black",14,"5,953",Ships to Bangladesh,1/7/2019
Audio Video ,"USB Wall Charger, Cube Charger 2 Port Charging Box 4Pack 2.1A/5V Home Travel Charger Plug USB Power Adapter Charging Station Base for iPhone 14 13 12 11 Pro Max XR XS X 8 7 6 Plus, iPad, iPod,Samsung",12,"3,113",Ships to Bangladesh,1/9/2019
Audio Video ,"PopSockets Phone Mount for Car, Car Vent Phone Mount, Car Mount for Phone - Black",16,"11,539",Ships to Bangladesh,1/9/2019
Audio Video ,"Uniden Bearcat BC125AT Handheld Scanner, 500-Alpha-Tagged Channels, Close Call Technology, PC Programable, Aviation, Marine, Railroad, NASCAR, Racing, and Non-Digital Police/Fire/Public Safety.",110,"7,574",Ships to Bangladesh,1/10/2019
Audio Video ,"USB C Car Charger, 2 Sockets Cigarette Lighter Splitter 12/24V 80W Dual USB Type-C Ports Separate Switch LED Voltage Display Built-in Replaceable 10A Fuse Compatible Mobile Cell Phone GPS Dash Cam",16,"10,803",Ships to Bangladesh,1/10/2019
Audio Video ,"DEWALT 20V MAX Bluetooth Speaker, 100 ft Range, Durable for Jobsites, Phone Holder Included, Lasts 8-10 Hours with Single Charge (DCR010), Yellow/Black",99,"7,947",Ships to Bangladesh,1/11/2019
Audio Video ,"Amazon Basics 3.5mm Aux Jack Audio Extension Cable, Male to Female, Adapter for Headphone or Smartphone, 6 Foot, Black",6,"57,662",Ships to Bangladesh,1/13/2019
Audio Video ,"Amazon Basics 12W One Port USB-A Wall Charger (2.4 Amp) for Phones (iPhone 13/12/11/X, Samsung, and more), Pack of 2, White",7,"31,091",Ships to Bangladesh,1/13/2019
Audio Video ,"MEE audio Connect Air in-Flight Bluetooth Wireless Audio Transmitter Adapter for up to 2 AirPods / Other Headphones; Works with All 3.5mm Aux Jacks on Airplanes, Gym Equipment, TVs, & Gaming Consoles",49,"2,020",Ships to Bangladesh,1/13/2019
Audio Video ,Harman Kardon Onyx Studio 7 Bluetooth Wireless Portable Speaker - 8 Hours Music Play time - Black,134,"1,680",Ships to Bangladesh,1/13/2019
Audio Video ,"Cobra 29 LTD Professional CB Radio - Easy to Operate Emergency Radio, Instant Channel 9, 4-Watt Output, Full 40 Channels, Adjustable Receiver and SWR Calibration, Dual-Mode AM/FM Access, Black",139,"3,479",Ships to Bangladesh,1/13/2019
Audio Video ,"Amazon Basics 2-Pack 3.5mm Aux Audio Cable for Stereo Speaker or Subwoofer with Gold-Plated Plugs, 4 Foot, Black",7,"72,951",Ships to Bangladesh,1/13/2019
Audio Video ,"SAMSUNG 15W Wireless Charger Duo w/ USB C Cable, Charge 2 Devices at Once, Cordless Super Fast Charging Pad for Galaxy Phones and Devices, 2022, US Version, Black",46,"1,066",Ships to Bangladesh,1/13/2019
Audio Video ,"Belkin Wireless Charger - Qi-Certified 10W Max Fast Charging Pad - Quick Charge Cordless Flat Charger - Universal Qi Compatibility for iPhone, Samsung Galaxy, AirPods, Google Pixel, and more",13,"2,563",Ships to Bangladesh,1/13/2019
Audio Video ,"JBL Charge 3 Waterproof Portable Bluetooth Speaker (Black), 1",131,"41,637",Ships to Bangladesh,1/13/2019
Audio Video ,"Belkin Magnetic Wireless Car Charger - MagSafe Compatible Car Mount Wireless Charger - Air Vent Mount With Included Power Supply for iPhone 14, iPhone 13 & iPhone 12 - Car Magnetic Phone Mount Charger",59,"1,808",Ships to Bangladesh,1/13/2019
Audio Video ,Marshall Emberton II Portable Bluetooth Speaker - Black & Brass,168,492,Ships to Bangladesh,1/13/2019
Audio Video ,"Adaptive Fast Type C Charger Compatible Samsung Galaxy S21+ S21 Ultra 5G S9 S8 Plus S10 S10e S20 FE Note 8 9 10 20 Plus, 2 Pack Charging Adapter + 2 Pack 6.6ft USB-C Cables",12,"14,845",Ships to Bangladesh,1/14/2019
Audio Video ,"Altec Lansing Mini H2O - Waterproof Bluetooth Speaker, IP67 Certified & Floats in Water, Compact & Portable Speaker for Hiking, Camping, Pool, and Beach",12,"15,081",Ships to Bangladesh,1/15/2019
Audio Video ,PopSockets PopMount Multi-Surface Mount for PopSockets PopGrip - Black,9,"1,935",Ships to Bangladesh,1/16/2019
Audio Video ,"Motorola T200TP Talkabout Radio, 3 Pack",84,"3,013",Ships to Bangladesh,1/16/2019
Audio Video ,"Pyle Marine Radio Receiver Speaker Set 12v Single Din Style Bluetooth Compatible Waterproof Digital Boat In Dash Console System with Mic 4 Speakers, Remote Control, Wiring Harness PLMRKT38W (White)",59,"1,631",Ships to Bangladesh,1/16/2019
Audio Video ,"JBL Flip 6 - Portable Bluetooth Speaker, powerful sound and deep bass, IPX7 waterproof, 12 hours of playtime, JBL PartyBoost for multiple speaker pairing, for home, outdoor and travel (Grey)",99,"6,019",Ships to Bangladesh,1/16/2019
Audio Video ,4 Long Range Walkie Talkies Rechargeable for Adults - NOAA 2 Way Radios Walkie Talkies 4 Pack - Long Distance Walkie-Talkies with Earpiece and Mic Set Headsets USB Charger Battery Weather Alert,79,"4,806",Ships to Bangladesh,1/18/2019
Audio Video ,"Cobra HHRT50 Road Trip CB Radio - 2-Way Handheld Emergency Radio with Access to Full 40 Channels & NOAA Alerts, Rooftop Magnet Mount Antenna and Omni-Directional Microphone, Black, 6.3"" x 2"" x 1.75""",89,"2,673",Ships to Bangladesh,1/19/2019
Audio Video ,"DEWALT DXFRS800 2 Watt Heavy Duty Walkie Talkies - Waterproof, Shock Resistant, Long Range & Rechargeable Two-Way Radio with VOX (2 Pack)",149,"2,556",Ships to Bangladesh,1/19/2019
Audio Video ,MOTOROLA SOLUTIONS Talkabout T460 Rechargeable Two-Way Radio Pair (Dark Blue),82,"5,195",Ships to Bangladesh,1/19/2019
Audio Video ,"DEWALT 12V/20V MAX Bluetooth Radio, Cordless, 100 ft Range, 3.5” Subwoofers, Portable for Jobsites (DCR028B)",179,"2,703",Ships to Bangladesh,1/19/2019
Audio Video ,"SanDisk 8GB Clip Jam MP3 Player, Black - microSD card slot and FM Radio - SDMX26-008G-G46K",34,"7,339",Ships to Bangladesh,1/20/2019
Audio Video ,Bitty Boomers Marvel Black Panther Blacklight - Mini Bluetooth Speaker,5,66,Ships to Bangladesh,1/20/2019
Audio Video ,Nite Ize Original Steelie Magnetic Phone Socket - Additional Magnet for Steelie Phone Mounting Systems,14,"15,641",Ships to Bangladesh,1/20/2019
Audio Video ,"ByronStatics Portable Radio AM FM, Vintage Retro Radio with Built in Speakers, Best Reception and Longest Lasting, Power Plug or 1.5V AA Battery - Cream",16,"9,491",Ships to Bangladesh,1/20/2019
Audio Video ,"SAMSUNG 45W Power Adapter (w/Cable C-to-C),USB,Black",39,830,Ships to Bangladesh,1/20/2019
Audio Video ,"Marshall Stanmore II Wireless Bluetooth Speaker, Black - NEW",379,"4,947",Ships to Bangladesh,1/20/2019
Audio Video ,"Cobra PX650 BCH6 - Professional/Business Walkie Talkies for Adults - Rechargeable, 300,000 sq. ft/25 Floor Range Two-Way Radio Set (6-Pack), Black",279,129,Ships to Bangladesh,1/20/2019
Audio Video ,Marshall Middleton Portable Bluetooth Speaker,299,76,Ships to Bangladesh,1/20/2019
Audio Video ,"SAMSUNG 35W Dual Port Wall Charger USB C Adapter, Super Fast Charging Block for Galaxy Phones and Devices, Cable Not Included, 2021, US Version, Black",32,"1,274",Ships to Bangladesh,1/20/2019
Audio Video ,"BAOFENG UV-5R Dual Band Two Way Radio (Black), 144-148MHz & 420-450MHz",44,"13,224",Ships to Bangladesh,1/20/2019
Audio Video ,"SanDisk 32GB Clip Sport Plus MP3 Player, Black - Bluetooth, LCD Screen, FM Radio - SDMX32-032G-G46K",279,"6,041",Ships to Bangladesh,1/20/2019
Audio Video ,"Marshall Acton III Bluetooth Home Speaker, Black",132,86,Ships to Bangladesh,1/20/2019
Audio Video ,Marshall Emberton Bluetooth Portable Speaker - Black,13,"5,607",Ships to Bangladesh,1/20/2019
Audio Video ,ByronStatics Portable Cassette Players Recorders FM AM Radio Walkman Tape Player Built In Mic External Speakers Manual Record VAS Automatic Stop System 2AA Battery Or USB Power Supply Headphone Jack,39,"18,920",Ships to Bangladesh,1/20/2019
Audio Video ,"Motorola T100 Talkabout Radio, 2 Pack",259,"9,421",Ships to Bangladesh,1/20/2019
Audio Video ,"DEWALT 20V MAX Bluetooth Radio, 100 ft Range, Battery and AC Power Cord Included, Portable for Jobsites (DCR025)",11,"1,915",Ships to Bangladesh,1/20/2019
Audio Video ,"MaximalPower RHF 617-1N 3.5mm RECEIVER/LISTEN ONLY Surveillance Headset Earpiece with Clear Acoustic Coil Tube Earbud Audio Kit For Two-Way Radios, Transceivers and Radio Speaker Mics Jacks , Black",121,"5,352",Ships to Bangladesh,1/20/2019
Audio Video ,"Motorola T600 Talkabout Radio, 2 Pack",26,"2,732",Ships to Bangladesh,1/21/2019
Audio Video ,JENSEN® Cassette Player/Recorder,159,"5,758",Ships to Bangladesh,1/21/2019
Audio Video ,"Cobra 29LX Professional CB Radio - Emergency Radio, Travel Essentials, NOAA Weather Channels and Emergency Alert System, Selectable 4-Color LCD, Auto-Scan and Radio Check, Black",29,"2,717",Ships to Bangladesh,1/21/2019
Audio Video ,"Pyle Wireless Portable Bluetooth Boombox Speaker - 100 Watt Rechargeable Boom Box Speaker Portable Music Barrel Loud Stereo System with AUX Input, MP3/USB/SD Port, Fm Radio, 2.5"" Tweeter PBMSPG3BK",133,"2,667",Ships to Bangladesh,1/21/2019
Audio Video ,Milwaukee 2951-20 M12 Lithium-Ion Cordless Radio + Charger (Tool Only),39,829,Ships to Bangladesh,1/21/2019
Audio Video ,"iOttie Car Charger Easy One Touch Wireless 2 Qi Charging Dashboard Phone Mount for iPhone, Samsung Galaxy, Huawei, LG, Smartphones",21,"5,518",Ships to Bangladesh,1/21/2019
Audio Video ,"LENRUE Bluetooth Speaker, Wireless Portable Speaker with Loud Stereo Sound, Rich Bass, 12-Hour Playtime, Built-in Mic. Perfect for iPhone, Samsung and More",22,"8,805",Ships to Bangladesh,1/23/2019
Audio Video ,"Leviton T5633-W 15-Amp Type A & Type-C USB Charger/Tamper Resistant Outlet, Not for Laptops, White",155,"1,773",Ships to Bangladesh,1/23/2019
Audio Video ,Harman Kardon Onyx Studio 6 Wireless Bluetooth Speaker - IPX7 Waterproof Extra Bass Sound System with Rechargeable Battery and Built-in Microphone - Black,99,"2,233",& Up,1/26/2019
Audio Video ,"45W USB C Super Fast Charger, INIU I622 PD PPS Foldable Dual USB C Wall Charger Supports Super Fast Charging for Samsung S23 Ultra/S23/S22/S21/S20/Note, MacBook Air, Steam Deck, iPhone 14, iPad",21,641,Ships to Bangladesh,1/26/2019
Audio Video ,Motorola Talkabout T465 Rechargeable Two-Way Radio Bundle (Green),97,"1,996",Ships to Bangladesh,1/26/2019
Audio Video ,"Uniden BCD436HP HomePatrol Series Digital Handheld Scanner. TrunkTracker V, Simple Programming, S.A.M.E. Emergency/Weather Alert, Covers USA and Canada",467,"2,980",Ships to Bangladesh,1/26/2019
Audio Video ,Marshall Emberton Bluetooth Portable Speaker - Black & Brass,119,"3,360",Ships to Bangladesh,1/26/2019
Audio Video ,"Motorola T260 Talkabout Radio, (Pack of 2)",79,"5,229",Ships to Bangladesh,1/26/2019
Audio Video ,10-Port USB Wall Charger Station with Rapid Charging Auto Detect Technology Safety Guaranteed Family-Sized USB Ports for Multiple Devices Smart Phone Tablet Laptop Computer,22,"4,425",Ships to Bangladesh,1/26/2019
Audio Video ,Marshall Willen Portable Bluetooth Speaker - Black & Brass,119,242,Ships to Bangladesh,1/26/2019
Audio Video ,"Klein Tools AEPJS1 Bluetooth Speaker, Wireless Portable Jobsite Speaker Plays Audio and Answers Calls Hands Free, IPX5, Worksite Ready, Orange, Black, Gray",39,"4,517",Ships to Bangladesh,1/26/2019
Audio Video ,"Uniden BC365CRS 500 Channel Scanner and Alarm Clock with Snooze, Sleep, and FM Radio with Weather Alert, Search Bands Commonly used for Police, Fire/EMS, Aircraft, Radio, and Marine Transmissions",95,"4,989",Ships to Bangladesh,1/27/2019
Audio Video ,"Amazon Basics 65W One-Port GaN USB-C Wall Charger with Power Delivery PD for Laptops, Tablets and Phones (iPhone 14/13/12/11/X, iPad, MacPro, Samsung, and more)-Black (non-PPS)",19,"3,736",Ships to Bangladesh,1/27/2019
Audio Video ,"SAMSUNG MX-ST40B Sound Tower High Power Audio, 160W Floor Standing Speaker, Bi-Directional Sound, Built-in Battery, IPX5 Water Resistant, Party Lights, Bluetooth Multi-Connection, 2022",247,98,Ships to Bangladesh,1/27/2019
Audio Video ,"Motorola T605 Talkabout, 2 Pack Bundle",119,"1,820",Ships to Bangladesh,1/28/2019
Audio Video ,"SAMSUNG Electronics Wireless Charger Trio, Qi Compatible - Charge up to 3 Devices at Once - for Galaxy Phones, Buds, Watches, and Apple iPhone Devices, Black (US Version)",61,"3,892",Ships to Bangladesh,1/30/2019
Audio Video ,"GPX PC332B Portable CD Player with Anti-Skip Protection, FM Radio and Stereo Earbuds - Black",24,"10,143",Ships to Bangladesh,1/30/2019
Audio Video ,Razer Mouse Dock Pro with Wireless Charging Puck: Magnetic Wireless Charging - Integrated HyperPolling 4K Hz Transceiver - Anti-Slip Base - Chroma RGB Lighting - Classic Black,69,55,Ships to Bangladesh,1/31/2019
Audio Video ,"KEYMOX Qi-Certified Wireless Charger for iPhone13/ 12/12 Mini/12 Pro Max / SE, 11, 11 Pro, 11 Pro Max, XR, Xs Max, XS, X, 8, 8 Plus, 10W Fast-Charging Galaxy S20 S10 S9 S8, Note 10(No AC Adapter)",10,"4,305",Ships to Bangladesh,2/1/2019
Audio Video ,"Amazon Basics 24W (4.8A) Two Port USB-A Car Charger for Apple, Android Devices and more, Black and Red",8,"19,329",Ships to Bangladesh,2/2/2019
Audio Video ,Belkin Magnetic Portable Wireless Charger Pad - 6’ (2M) Long Cable - MagSafe Charger Compatible - iPhone Charger - Works w/ iPhone 14/13 & 12 - Power Supply Included - Black (Package May Vary),12,"1,585",Ships to Bangladesh,2/2/2019
Audio Video ,"Uniden BCD996P2 Digital Mobile TrunkTracker V Scanner, 25,000 Dynamically Allocated Channels, Close Call RF Capture Technology, 4-Line Alpha display, Base/Mobile Design, Phase 2, Location-Based Scanning",389,"1,321",Ships to Bangladesh,2/2/2019
Audio Video ,"Altec Lansing Sonic Boom - Waterproof Bluetooth Speaker with Phone Charger, IP67 Outdoor Speaker, 3 USB Charging Ports, 50 Foot Range & 20 Hours Battery Life",149,"1,101",Ships to Bangladesh,2/3/2019
Audio Video ,"USB C Charger, INIU 30W PD QC 3.0 Dual Port Type C Charger Fast Charging Block, USB C Wall Charger with Foldable Plug for iPhone 14 13 12 11 Pro Max Samsung S21 S20 Note 20 iPad Pro Google LG AirPods",15,"2,343",Ships to Bangladesh,2/3/2019
Audio Video ,"Uniden BC355N 800 MHz 300-Channel Base/Mobile Scanner, Close Call RF Capture, Pre-programmed Search “Action” Bands to Hear Police, Ambulance, Fire, Amateur Radio, Public Utilities, Weather, and More, Black",113,"5,151",Ships to Bangladesh,2/4/2019
Audio Video ,"SAMSUNG 15W Wireless Charger Single, Cordless Super Fast Charging Pad for Galaxy Phones and Devices, USB C Cable Included, 2022, US Version, Black",48,549,Ships to Bangladesh,2/4/2019
Audio Video ,"Amazon Basics 36W Two-Port USB-C Wall Charger with Power Delivery PD for Tablets & Phones (iPhone 14/13/12/11/X,iPad,Samsung)-Black (non-PPS)",13,"1,761",Ships to Bangladesh,2/4/2019
Audio Video ,"NOCO NUSB211NA 10W USB Power Adapter, 2.1A 5V Wall Charger and Compatible with NOCO, Apple, Samsung, Google, Amazon Devices",13,"5,088",Ships to Bangladesh,2/6/2019
Audio Video ,"Victrola Retro Wood Bluetooth Radio with Built-in Speakers, Elegant & Vintage Design, Rotary AM/FM Tuning Dial, Wireless Streaming, Walnut",54,"6,310",Ships to Bangladesh,2/6/2019
Audio Video ,Bose Music Amplifier – Speaker amp with Bluetooth & Wi-Fi connectivity,599,35,Ships to Bangladesh,2/6/2019
Audio Video ,"Car Charger, 150W 2-Socket Cigarette Lighter Splitter QC 3.0 Dual USB Ports 1 USB C Fast Car Adapter with Separate Switch LED Voltmeter Replaceable 15A Fuse for GPS/Dash Cam/Phone/iPad",18,"5,628",Ships to Bangladesh,2/6/2019
Audio Video ,"Dell Dual Charge Dock HD22Q - Fabric Wrapped Charging Stand, Type-C Connector, Qi Enabled Charging, Wake-on-Dock, Smartphone Rest, Power Button LED - Magnetite,Black",131,28,Ships to Bangladesh,2/7/2019
Audio Video ,OtterBox Performance Car Dash & Windshield Mount for MagSafe - Black,49,914,Ships to Bangladesh,2/7/2019
Audio Video ,Sangean WR-11SE AM/FM Table Top Radio 40th Anniversary Edition Walnut,81,"5,133",Ships to Bangladesh,2/8/2019
Audio Video ,"PopSockets Phone Wallet with Expanding Grip, Phone Card Holder, Wireless Charging Compatible, Wallet for MagSafe - Blanc Fresh",39,112,Ships to Bangladesh,2/11/2019
Audio Video ,"Belkin 3-in-1 Wireless Charger - Fast Wireless Charging Stand for Apple iPhone, Apple Watch & AirPods - iPhone Case Compatible Qi Charger - Wireless Charging Station For Multiple Devices - Black",119,"2,953",Ships to Bangladesh,2/11/2019
Audio Video ,"Uniden Bearcat SR30C, 500-Channel Compact Handheld Scanner, Close Call RF Capture, Turbo Search, PC programable, NASCAR, Racing, Aviation, Marine, Railroad, and Non-Digital Police, Fire, Public Safety",99,"2,402",Ships to Bangladesh,2/11/2019
Audio Video ,"SAMSUNG Galaxy 15W Wireless Charger Single, Cordless Super Fast Charging Pad w/ Wall Charger and USB Type C Cable Included for Galaxy Phones and Devices, US Version, 2022, White",47,100,Ships to Bangladesh,2/11/2019
Audio Video ,Midland LXT600BBX4 FRS Business Bundle,319,"7,799",Ships to Bangladesh,2/11/2019
Audio Video ,"NOCO U65 65W USB-C Charger, Power Delivery (PD) Fast Charger, Portable Micro Wall Charger and International Travel Charger with Interchangeable Plugs for Apple, Google, Samsung, Microsoft and More",69,418,Ships to Bangladesh,2/11/2019
Audio Video ,"Amazon Basics 10W Qi Certified Wireless Charging Stand (No AC Adapter), Black",17,"1,666",Ships to Bangladesh,2/11/2019
Audio Video ,"USB A & USB C Charger Block, INIU 45W PD QC3.0 PPS USB-C Foldable Wall Charger Supports Super Fast Charging for Samsung S23 Ultra S23 S22 S21 S20, iPhone 14 13 12, iPad, MacBook Air, Steam Deck",18,109,Ships to Bangladesh,2/11/2019
Audio Video ,"Uniden PRO401HH Professional Series 40 Channel Handheld CB Radio, 4 Watts Power with Hi/Low Power Switch, Auto noise cancellation, Belt Clip And Strap Included, 2.75in. x 4.33in. x 8.66in.",49,"3,232",Ships to Bangladesh,2/11/2019
Audio Video ,"Bang & Olufsen Beosound A1 (2nd Generation) Wireless Portable Waterproof Bluetooth Speaker with Microphone, Anthracite",227,"2,845",Ships to Bangladesh,2/12/2019
Audio Video ,"3-in-1 MagSafe Charger Stand, 18W Fast Magnetic Charger for iPhone 14, 13 & 12 Series - Apple Watch & AirPods, Wireless Charging Station for Multiple Devices with Adapter and LED",35,137,Ships to Bangladesh,2/14/2019
Audio Video ,"Amazon Basics 15W Qi Certified Wireless Charging Pad (No AC Adapter), Black",17,"2,499",Ships to Bangladesh,2/14/2019
Audio Video ,"Samsung Type-C to Type-C 1.8m Cable (3A), Black",10,131,Ships to Bangladesh,2/14/2019
Audio Video ,"Samsung 65W 3-Port Super Fast Charging Wall Charger, 1x USB-C 65W, 1x USB-C 25W, 1x USB-A 25W, Max capacity 65W (Cable not included), Black, US version",59,195,Ships to Bangladesh,2/14/2019
Audio Video ,"Uniden HomePatrol-2 Color Touchscreen Simple Program Digital Scanner, TrunkTracker V and S,A,M,E, Emergency/Weather Alert, APCO P25 Phase 1 and 2! Covers USA and Canada, Quick Record and Playback",445,"1,312",Ships to Bangladesh,2/15/2019
Audio Video ,Marshall Acton II Bluetoth Speaker,250,"1,039",Ships to Bangladesh,2/16/2019
Audio Video ,"Belkin iPhone MagSafe Camera Mount for MacBook, iPhone Continuity Camera Mount, Turn iPhone to Webcam, Compatible with MacBook Pro, Air, iPhone 14, iPhone 13, iPhone 12, Black",29,324,Ships to Bangladesh,2/16/2019
Audio Video ,"Belkin 40W Dual Port USB C Wall Charger - USB Type C Charger Fast Charging for iPhone 14, 14 Pro, 14 Pro Max, 13, 13 Pro, 13 Pro Max, Galaxy S21 Ultra, iPad, AirPods & More - USBC Charger (1-Pack)",29,"1,290",Ships to Bangladesh,2/17/2019
Audio Video ,"Bang & Olufsen Beolit 20 Powerful Portable Wireless Bluetooth Speaker, Grey Mist",399,895,Ships to Bangladesh,2/18/2019
Audio Video ,FIRESTIK K-4A CB RADIO ANTENNA HEAVY DUTY SO-239 STUD MOUNT (BULK),12,"3,107",Ships to Bangladesh,2/18/2019
Audio Video ,Sangean LB-100 Ultra Rugged Compact AM / FM Radio Yellow,74,"3,461",Ships to Bangladesh,2/20/2019
Audio Video ,SABRENT 60 Watt (12 Amp) 10 Port [UL Certified] Family Sized Desktop USB Rapid Charger. Smart USB Ports with Auto Detect Technology [Black] (AX-TPCS),27,"8,255",Ships to Bangladesh,2/20/2019
Audio Video ,"Motorola T200 Talkabout Radio, 2 Pack",45,"1,147",Ships to Bangladesh,2/20/2019
Audio Video ,"Scosche MAGWDM MagicMount Magnetic Car Phone Holder Windshield or Dashboard Mount - 360 Degree Adjustable Head, Universal with All Devices - Flex Neck Suction Mount (Color:Black) XL",11,"11,049",Ships to Bangladesh,2/21/2019
Audio Video ,"Olympus WS-853 black voice recorder with true stereo mic, 8GB, 110 hours battery life, voice balance, direct USB connection, with MP3 file format.",75,"1,771",Ships to Bangladesh,2/22/2019
Audio Video ,"Uniden BCD325P2 Handheld TrunkTracker V Scanner. 25,000 Dynamically Allocated Channels. Close Call RF Capture Technology. Location-Based Scanning and S.A.M.E. Weather Alert. Compact Size.",348,818,Ships to Bangladesh,2/23/2019
Audio Video ,ULTIMATE EARS Boom 3 Portable Bluetooth Wireless Speaker (Waterproof) - Night Black (Renewed),24,"2,511",Ships to Bangladesh,2/23/2019
Audio Video ,"iOttie iTap 2 Magnetic Dashboard Car Mount Holder || Cradle for Samsung Galaxy S22, Google Pixel 7, Motorola Moto G, OnePlus 10, Sony Xperia & Other Android Smartphones",19,"5,128",Ships to Bangladesh,2/24/2019
Audio Video ,"ByronStatics Portable Disc CD player, Personal Walkman Music CD Players Anti-Skip Shockproof Protection, Portable and Lightweight, Headphones Jack, Powered DC or 2XAA Battery - Pink",94,908,Ships to Bangladesh,2/24/2019
Audio Video ,"Uniden MHS75 Waterproof Handheld 2-Way VHF Marine radio, Submersible, Selectable 1/2.5/5 Watt Transmit Power. All USA/International and Canadian Marine Channels - Color Black",41,"1,916",Ships to Bangladesh,2/27/2019
Audio Video ,"SAMSUNG 15W Wireless Charger Duo w/ USB C Cable, Charge 2 Devices at Once, Cordless Super Fast Charging Pad for Galaxy Phones and Devices, 2022, US Version, White",15,166,Ships to Bangladesh,3/1/2019
Audio Video ,"Amazon Basics Universal Smartphone Holder for Car Air Vent, Grey",428,"4,670",Ships to Bangladesh,3/1/2019
Audio Video ,"Marshall Woburn II Wireless Bluetooth Speaker Black, - New",76,"1,352",Ships to Bangladesh,3/1/2019
Audio Video ,"Cobra ACXT645 Waterproof Walkie Talkies for Adults - Rechargeable, 22 Channels, Long Range 35-Mile Two-Way Radio Set (2-Pack), Black and Orange, 1.74 x 2.54 x 6.74 inches",16,513,Ships to Bangladesh,3/1/2019
Audio Video ,"SAMSUNG 15W Wall Charger Type C (USB-C Cable Included), Black",69,355,Ships to Bangladesh,3/1/2019
Audio Video ,"NAXA Electronics NPB-426 Portable CD Player with AM/FM Stereo Radio, Cassette Player/Recorder and Twin Detachable Speakers",79,"3,159",Ships to Bangladesh,3/1/2019
Audio Video ,"Pyle 4” Waterproof Off-Road Bluetooth Speakers -800W Power w/ Amplified Speaker System for ATV/UTV,Aux (3.5mm) Input Jack,Marine Grade Weatherproof,Great for Use w/all 12V Vehicles- PLUTV43BTA ,Black",166,872,Ships to Bangladesh,3/1/2019
