Product Category,Product Description,Price(Dollar),Number of  reviews,Shipment,Order Date
Audio Video ,Monoprice 3.5mm Stereo Plug to 6.35mm (1/4 Inch) Stereo Jack Adaptor - Gold Plated,17,"2,200",Ships to Bangladesh,5/2/2019
Audio Video ,"Victrola 1980s Retro Bluetooth Boombox with Cassette Player and AM/FM Radio, Wired and Wireless Streaming, Classic 80s Style with Modern Technology, Silver",4,"1,138",Ships to Bangladesh,5/3/2019
Audio Video ,JENSEN SMPS-628 Under Cabinet Universal Bluetooth Music System,193,"1,070",Ships to Bangladesh,5/3/2019
Audio Video ,"PHILIPS S3505 Wireless Bluetooth Speaker with Bold Sound, Kvadrat Speaker Fabric, Up to 10 Hours Playtime, IPX7 Waterproof, Shower Ready, Small Size, Gray",34,864,Ships to Bangladesh,5/3/2019
Audio Video ,OtterBox Wireless Charging Stand for MagSafe - BLACK,33,29,Ships to Bangladesh,5/4/2019
Audio Video ,"Cobra HG S300 Highgear External Noise-Cancelling Speaker,Beige",32,187,Ships to Bangladesh,5/4/2019
Audio Video ,"Scosche MP2CUPM-SP MagicMount Pro2 Cup Holder Magnetic Cell Phone Holder Car Mount Kit Compatible with MagSafe, iPhones, Galaxy, Pixel & All Smartphones",24,267,Ships to Bangladesh,5/4/2019
Audio Video ,"Pyle Portable Waterproof Bluetooth Speaker - 280 Watt Max Output Power, Wireless Music Streaming, Rechargeable Battery, MP3/WMA/FLAC Digital Audio File Support, & Remote Control Battery Operated",44,595,Ships to Bangladesh,5/4/2019
Audio Video ,ROADPRO RP-235 Adjustable Universal Mounting Bracket for CB/Ham Radio & Scanners,143,109,Ships to Bangladesh,5/4/2019
Audio Video ,"mophie snap+ Wireless Charger - 15W Wireless Charging pad for Qi-Enabled and MagSafe Compatible Devices, compatible with All new iPhones",11,683,Ships to Bangladesh,5/4/2019
Audio Video ,"Unitek USB Charging Station for Multiple Devices, Charger Organizer Stand Dock with Dividers, Quick Charge 3.0 Compatible for Smartphone, Tablet, iPad and Other Electronics",29,275,Ships to Bangladesh,5/5/2019
Audio Video ,"Cellet Dual Adjustable Phone Holder & Tablet Mount for Car Back Seat Headrest Compatible with Apple iPad, Air, Pro, Mini, iPhone 14 Pro Max Plus 13 Samsung Galaxy, Google Pixel, Moto",67,596,Ships to Bangladesh,5/5/2019
Audio Video ,Sangean DAR-101 Professional Grade Digital MP3 Recorder (Black),16,"1,455",& Up,5/5/2019
Audio Video ,"Hosa CSS-830 1/4"" TRS to Same Balanced Patch Cables, 1 Foot",33,240,Ships to Bangladesh,5/5/2019
Audio Video ,"Hosa YPP-136 1/4"" TRSF to Dual 1/4"" TS Stereo Breakout Cable",79,"1,758",Ships to Bangladesh,5/5/2019
Audio Video ,"Victrola VBB-25-SLV Mini Bluetooth Boombox with Cassette Player, Recorder and Am/FM Radio, Silver",6,719,Ships to Bangladesh,5/5/2019
Audio Video ,"Pinkfong Baby Shark 9'' Portable DVD Player for Kids with Matching Headphones and Carrying Bag, Compatible with CDs, DVDs, USB and SD Card, Swivel Screen",43,16,Ships to Bangladesh,5/5/2019
Audio Video ,Pack Of 10 Type C Fast Charge Cable USB Cord Charging Rapid Quick Charger Bulk For Samsung Galaxy S10+ S9+ S8+ Note 9 8 A20 A50 A70 A90 A21 A51 A71 A91 LG V60 V50 V40 V30 V20 ThinQ Stylo 4 5 6 (White),69,425,Ships to Bangladesh,5/6/2019
Audio Video ,"TALK WORKS USB C Cable 10ft Long Android Phone Charger Premium Nylon Braided Heavy Duty Type C Fast Charging Cord for Samsung Galaxy S21 / S20 / S10 / S9 / S8, Note, Pixel, Nintendo Switch - Slate",8,"2,320",Ships to Bangladesh,5/6/2019
Audio Video ,"Bushnell Disc Jockey -Bluetooth -Speaker, Lightweight Disk Golf -Speaker with Distance to Basket -GPS, White/Orange, Small",10,104,Ships to Bangladesh,5/6/2019
Audio Video ,Polaroid P1 Music Player (Blue) - Super Portable Wireless Bluetooth Speaker Rechargeable with IPX5 Waterproof and Dual Stereo Pairing,59,41,Ships to Bangladesh,5/7/2019
Audio Video ,"CRAFTSMAN V20 Bluetooth Speaker, Tool Only (CMCR001B) , Red",21,307,Ships to Bangladesh,5/7/2019
Audio Video ,"Theater Solutions by Goldwood B63GR Wireless Rechargeable Bluetooth Outdoor 6.5 Inch Rock Speaker System – Slate Gray, Set of 2, 200 Watts",89,405,Ships to Bangladesh,5/7/2019
Audio Video ,"Pyle Wireless Portable Bluetooth Speaker- 100 Watt Power Rugged Compact Audio Sound Box Stereo System with Built-in Rechargeable Battery, 3.5mm AUX Input Jack,FM Radio,MP3 & USB Reader-PBMSQG5, Black",219,"1,263",Ships to Bangladesh,5/7/2019
Audio Video ,DualX Dual USB Charger for Car And Home by RapidX - Blue,37,"1,163",Ships to Bangladesh,5/7/2019
Audio Video ,Echelon Beat Advanced Armband Heartrate Monitor,13,209,Ships to Bangladesh,5/7/2019
Audio Video ,"Tuff Tech Super Stick Universal Car Mount Phone Holder Desk Stand with Suction Cup Base and Adjustable Arm for -iPhone, Samsung, LG, Moto, Huawei, Smartphones",38,355,Ships to Bangladesh,5/7/2019
Audio Video ,"Pyle Wireless Portable Bluetooth Boombox Speaker - 300 Watt Rechargeable Boom Box Speaker Portable Music Barrel Loud Stereo System with AUX Input, MP3/USB Port, Fm Radio, 2.5"" Tweeter - Pyle PBMSPRG4",22,511,Ships to Bangladesh,5/7/2019
Audio Video ,"Sangean CL-100 NOAA, S.A.M.E and Public Alert Certified Weather Alert Table-Top Radio with AM / FM-RBDS, and EEPROM Back Up for Preset Stations",29,"1,252",Ships to Bangladesh,5/8/2019
Audio Video ,"Scosche MEDSG-XTET MagicMount Elite Universal Magnetic Dash Mount for Mobile Devices, Space Gray",72,141,Ships to Bangladesh,5/9/2019
Audio Video ,"Margaritaville Cooler Bluetooth Speaker, Wireless & Portable Speaker with Ice Chest, 12 Can & Bottle Capacity, 33 Foot Range & 5 Hours of Playtime, Navy",19,89,Ships to Bangladesh,5/9/2019
Audio Video ,"Motorola TurboPower Bundle: 20W Wall Charger & 18W Car Charger with Two 1m USB-A to USB-C Cables for Moto G Power (2020/2021/2022), G Stylus (2020/2021/5G), One 5G/5G UW/5G Ace/5G UW Ace, Edge/Edge+",39,"1,127",Ships to Bangladesh,5/9/2019
Audio Video ,SOAR NFL Unisex ShockBox XL Wireless Bluetooth Speaker,31,568,Ships to Bangladesh,5/9/2019
Audio Video ,PopSockets PopPower Home Wireless Charger for Phones and Tablets - Night Blooms,23,"1,721",Ships to Bangladesh,5/9/2019
Audio Video ,"Uniden PRO538HHFM, “2 in 1” Dual Handheld/Mobile Emergency CB Radio with New FM Mode, Full 40 Channels, NOAA Weather Alerts, and Selectable 4-Watts HI/1-Watt Low Output Power.",36,1,Ships to Bangladesh,5/9/2019
Audio Video ,"SAMSUNG 9W Wireless Charger Duo w/ USB C Cable, Charge 2 Devices at Once, Cordless Super Fast Charging Pad for Galaxy Phones and Devices, 2021, US Version, White",59,376,& Up,5/10/2019
Audio Video ,"Pyle 280 Watt Max Party Portable Wireless Bluetooth Speaker with Subwoofer and Tweeters, MP3/ USB Port/AUX/FM Radio, Colorful LED Lights, Powerful Loudspeaker for Indoor and Outdoor Use",129,27,& Up,5/10/2019
Audio Video ,Kanto YU4MW Powered Speakers with Bluetooth and Built-in Phono Preamp | Auto Standby and Startup | Remote Included | 140W Peak Power | Pair | Matte White,379,522,Ships to Bangladesh,5/10/2019
Audio Video ,"KOHLER Moxie Bluetooth Showerhead, Shower, Waterproof Speaker, Shower Radio, Rechargeable, Portable Speaker, 2.5 GPM, K-28238-NKE-BL, Matte Black",99,590,Ships to Bangladesh,5/10/2019
Audio Video ,"Bitty Boomers Disney Stitch with Sunglasses Bluetooth Speaker, Multicolor",19,"1,521",Ships to Bangladesh,5/10/2019
Audio Video ,Sangean WR-16 AM/FM Bluetooth Wooden Cabinet Radio,117,296,Ships to Bangladesh,5/10/2019
Audio Video ,"PyleUsa Dual Stereo Cassette Tape Deck-Clear Audio Double Player Recorder System w/ MP3 Music Converter, RCA for Recording, Dubbing, USB, Retro Design - for Standard/CrO2 Tapes, Home Use - PT659DU.5",170,45,Ships to Bangladesh,5/10/2019
Audio Video ,"Sangean America, Inc. PS-100 Pillow 3.5mm Aux Portable Speaker, White, One Size",14,"3,224",Ships to Bangladesh,5/10/2019
Audio Video ,Sony DEJ011 Portable Walkman CD Player (Discontinued by Manufacturer),295,882,Ships to Bangladesh,5/11/2019
Audio Video ,"Midland – BizTalk BR200 Business Radio – 2W Industrial Grade Two Way Radio – Compact Size – High Performance Walkie Talkie – 250,000 Square Feet of Coverage",99,62,Ships to Bangladesh,5/11/2019
Audio Video ,TRAM 703-HC Center Load CB Antenna Kit,26,"1,817",Ships to Bangladesh,5/11/2019
Audio Video ,"Monster Blaster 3.0 Portable Speaker, 120W Wireless Bluetooth Speaker, IPX5 Rechargeable Waterproof Bluetooth Speaker with USB Charge Out & Aux Input",223,632,Ships to Bangladesh,5/11/2019
Audio Video ,"Cobra ACXT390 Walkie Talkies for Adults - Rechargeable, Lightweight, 22 Channels, 23-Mile Range Two-Way Radios with VOX (2-Pack)",55,762,Ships to Bangladesh,5/11/2019
Audio Video ,"PAXCESS Split Bluetooth Speaker with 20W Dual Speakers, TWS Pairing, Bluetooth 5.0, IPX7 Waterproof, 14H Playtime, 360° Surround Sound, Wireless Speaker for Home, Outdoors",55,46,Ships to Bangladesh,5/11/2019
Audio Video ,Twelve South PowerPic mod | Multi-Position Wireless 10W Qi Charger for iPhone/Wireless Charging Smart Phones and AirPods Pro (Black),54,304,Ships to Bangladesh,5/11/2019
Audio Video ,MEE audio DualStream S1 Headphone and Speaker Bluetooth Wireless Audio Transmitter/Streamer with aptX Low Latency technology for TVs and other devices (analog input via headphone jack or RCA),32,463,Ships to Bangladesh,5/11/2019
Audio Video ,"Altec Lansing LifeJacket 3 - Waterproof Bluetooth Speaker, Wireless & Portable Speaker for Travel & Outdoor Use, 30 Hour Playtime & 50 Foot Range, Black",56,65,Ships to Bangladesh,5/12/2019
Audio Video ,"PyleUsa Wireless Portable Bluetooth Boombox Speaker - 2Ch Waterproof Rechargeable Fabric Stereo Speaker w/Google Assistant/Siri Voice Control, TWS Function, USB FM Radio, RGB Lights -PSBWP9BK (Black)",53,158,Ships to Bangladesh,5/12/2019
Audio Video ,"Belkin 37W Dual Port Fast Car Charger with 3.3ft USB-C Cable Included, USB-C 25W PPS Port and USB-A 12W Port for Galaxy S23, S23+, Ultra, Note20, iPhone 14, 13, 12, 11, Pro, Max, Mini and More",29,6,Ships to Bangladesh,5/13/2019
Audio Video ,"Koomus Urban-CD-N Smartphone Magnetic Car Mount for CD Slot, Black",27,574,Ships to Bangladesh,5/13/2019
Audio Video ,Bitty Boomers Disney: The Little Mermaid - Ariel - Mini Bluetooth Speaker,19,134,Ships to Bangladesh,5/13/2019
Audio Video ,"Hosa CSS-103RR Right Angled 1/4"" TRS Balanced Interconnect Cable, 3 feet",7,467,Ships to Bangladesh,5/13/2019
Audio Video ,"Midland GXT1000 GMRS Walkie Talkie - Long Range Two Way Radio with NOAA Weather Scan + Alert, 50 Channels, and 142 Privacy Codes (Black/Silver, 12 Radios)",11,13,Ships to Bangladesh,5/13/2019
Audio Video ,Sangean PR-D15 Digital Portable Stereo RDS Receiver Gray,524,835,Ships to Bangladesh,5/13/2019
Audio Video ,Motorola Solutions T210TP Two-Way Radio Black W/Red Three-Pack,88,66,Ships to Bangladesh,5/14/2019
Audio Video ,Sangean WR-2 AM / FM-RBDS Wooden Cabinet Digital Tuning Radio (Walnut),67,"1,624",& Up,5/16/2019
Audio Video ,"Altec Lansing LifeJacket Mini - Waterproof Bluetooth Speaker with Lights, Portable Wireless Speaker for Pool, Beach, Hiking, Sports, Camping, 16 Hour Playtime, Floats in Water",69,859,Ships to Bangladesh,5/16/2019
Audio Video ,JENSEN CD-590-BL CD-590 1-Watt Portable Stereo CD and Cassette Player/Recorder with AM/FM Radio and Bluetooth (Blue),58,56,Ships to Bangladesh,5/17/2019
Audio Video ,CB Radio Antenna Quick Release Mirror Mount with 180 Degree Swivel - Workman QRCS3,21,170,Ships to Bangladesh,5/18/2019
Audio Video ,Sangean DT-400W AM/FM Digital Weather Alert Pocket Radio,54,"1,357",Ships to Bangladesh,5/18/2019
Audio Video ,"Axess SPBT1031 Portable Bluetooth Indoor/Outdoor 2.1 Hi-Fi Cylinder Loud Speaker with Built-in 3"" Sub and SD Card, USB, AUX Inputs in Red",31,"2,226",Ships to Bangladesh,5/18/2019
Audio Video ,"Type C Car Charger, 3.4A Fast Charging USB Car Adapter with 3ft USB C Cable for Samsung Galaxy S23 S22 S21 S20 S10 Note 20 A54 A14 A03S A13 A53 A23 A12 A32 A51,LG Stylo 6 5 4,Pixel 7 Pro 6a 6 5 4 3a",8,753,Ships to Bangladesh,5/18/2019
Audio Video ,Standard STD-CMP460 Speaker/Mic for Most Standard Handheld VHF Radios,52,85,Ships to Bangladesh,5/19/2019
Audio Video ,Bowers & Wilkins Zeppelin Wireless Music System w/Apple AirPlay 2 & Bluetooth (Midnight Grey),799,120,Ships to Bangladesh,5/19/2019
Audio Video ,"Monoprice Onyx Series Auxiliary 3.5mm TRRS Audio & Microphone Cable, 3ft - (118632) Black",4,"1,399",Ships to Bangladesh,5/20/2019
Audio Video ,BAOFENG UV-5R VHF/UHF Dual Band Radio 144-148MHz 420-450MHz Transceiver,22,"1,169",Ships to Bangladesh,5/20/2019
Audio Video ,Bose SoundDock Portable 30-Pin iPod/iPhone Speaker Dock,175,783,Ships to Bangladesh,5/20/2019
Audio Video ,Sangean U4 AM/FM-RBDS/Weather Alert/Bluetooth/Aux-in Ultra Rugged Rechargeable Digital Tuning Radio Yellow,85,572,Ships to Bangladesh,5/20/2019
Audio Video ,"Pyle 300 Watt Outdoor Indoor Wireless Bluetooth Portable PA Speaker 6.5 inch Subwoofer Sound System with USB SD Card Reader, Rechargeable Battery, Wired Microphone, FM Radio, Remote - PWMAB250BK",84,902,Ships to Bangladesh,5/20/2019
Audio Video ,"Altec Lansing StormChaser Rechargeable Emergency Radio, Portable Bluetooth Speaker with NOAA AM FM for Weather Alerts, Solar Powered Survival Speaker with Cellphone USB Charger, LED Camping Flashlight",18,66,Ships to Bangladesh,5/20/2019
